{
  "schemaVersion": 1,
  "projectId": "ium-lernwerk",
  "asOf": "2026-09-03",
  "scope": {
    "profileType": "planning-profile",
    "grades": [5, 6, 7],
    "schoolType": "Gymnasium Baden-Württemberg",
    "level": "E",
    "individualDiagnosis": "prohibited",
    "maturity": "working",
    "statementBoundaries": [
      "Das Profil beschreibt vorhersehbare Varianz für die Planung und keine durchschnittliche oder typische Person.",
      "Jahrgangsstufen bestimmen curriculare Erwartungen, sind aber kein Ersatz für aufgabenbezogene Beobachtung von Vorwissen, Sprache, Bedienroutinen oder Unterstützungsbedarf.",
      "Einzelantworten, Klicks, Bearbeitungszeiten und Hilfenutzung werden nicht zu stabilen Personenmerkmalen oder Defizitlabels verdichtet.",
      "Der Basiskurs Medienbildung 2016 und der Aufbaukurs Informatik 2016 bleiben amtliche Grundlagen; die Lesehilfe 2026/2027 bleibt Orientierung.",
      "Das Profil begründet Planungsfolgen, aber weder Lernwirksamkeit des IuM-Lernwerks noch eine universelle Altersregel oder ein fertiges Materialmuster."
    ]
  },
  "dimensions": [
    {
      "id": "prior-knowledge-and-conceptions",
      "label": "Vorwissen und Vorstellungen",
      "evidenceSupportedAssumptions": [
        {
          "id": "LXF03-S-001",
          "statement": "Fachliches Vorwissen und aktuelle Vorstellungen müssen an der konkreten Aufgabe sichtbar gemacht werden, bevor Schwierigkeit, Erklärung und Unterstützung festgelegt werden.",
          "claimIds": ["CLAIM-LP-002"],
          "grades": [5, 6, 7],
          "variability": "Lernende desselben Jahrgangs können sehr unterschiedliche schulische Vorerfahrungen, Alltagsmodelle, Fachbegriffe und Strategien mitbringen; eine einzelne Antwort kann zudem situativ oder sprachlich bedingt sein.",
          "designConsequence": {
            "learnerMaterial": "Kurze Vorhersagen, Modellskizzen, Sortierungen oder Kontrastfälle öffnen die Aufgabe, ohne Personen einzustufen oder Inhalte vorwegzunehmen.",
            "teacherOrchestration": "Die Lehrkraft sichtet aktuelle Produkte oder Gesprächsbeiträge, klärt Mehrdeutigkeiten und entscheidet erst danach über Erklärung, Gruppierung und Hilfen."
          },
          "status": "working",
          "limitations": [
            "Der Claim beschreibt Zusammenhänge mit Wissensständen, aber keine sichere Vorhersage individuellen Lernzuwachses.",
            "Eine lokale Erhebung ist eine Planungsinformation für die aktuelle Aufgabe und keine Diagnose eines stabilen Fehlkonzepts."
          ]
        },
        {
          "id": "LXF03-S-002",
          "statement": "Vorbereitete Problemlösung kann nur als begrenzter, anschlussfähiger Zugang geplant werden und benötigt besonders bei jüngeren Lernenden ein sichtbares Überforderungsgate sowie anschließende Erklärung.",
          "claimIds": ["CLAIM-LP-012"],
          "grades": [5, 6, 7],
          "variability": "Vorläuferwissen, Problemschema, sprachlicher Zugang und Erfahrung mit offenen Aufgaben variieren innerhalb aller drei Jahrgänge stärker, als eine feste Altersregel abbilden könnte.",
          "designConsequence": {
            "learnerMaterial": "Explorative Einstiege begrenzen den Lösungsraum, machen das Zielwissen erreichbar und führen erkennbar zu Vergleich, Erklärung und Sicherung.",
            "teacherOrchestration": "Die Lehrkraft setzt einen frühen Haltepunkt, prüft produktbezogen Überforderung und wechselt bei Bedarf zu Modellierung oder stärker geführter Bearbeitung."
          },
          "status": "working",
          "limitations": [
            "Die zugrunde liegende Evidenz stammt überwiegend aus Mathematik und deckt Klasse 5 nur teilweise ab.",
            "Aus dem Claim folgt weder unbegleitetes Entdecken noch eine verbindliche Sequenz für jedes IuM-Thema."
          ]
        }
      ],
      "curriculumAndProjectExpectations": [
        {
          "id": "LXF03-E-001",
          "basis": "official-curriculum",
          "statement": "In Klasse 5 soll Medienbildung an Erfahrungen anknüpfen und Nutzungsverhalten beschreiben sowie vergleichen lassen.",
          "grades": [5],
          "referenceIds": ["BMB16-GYM-PK-RK-001"],
          "limitations": [
            "Der amtliche Record erlaubt keine Pflicht zur Offenlegung sensibler persönlicher Angaben."
          ]
        },
        {
          "id": "LXF03-E-002",
          "basis": "orientation",
          "statement": "Für Klassen 5 und 6 beschreibt die Lesehilfe erste algorithmische Denk- und Vorgehensweisen als grundlegend und noch nicht auf dem fachlichen Niveau des Aufbaukurses Klasse 7.",
          "grades": [5, 6],
          "referenceIds": ["LH26-E-PROG-002"],
          "limitations": [
            "Die Lesehilfe ist ein Orientierungsrahmen und legt weder eine verbindliche Jahrgangsverteilung noch eine universelle Altersmethode fest."
          ]
        },
        {
          "id": "LXF03-E-003",
          "basis": "official-curriculum",
          "statement": "In Klasse 7 gehört es zur fachlichen Problembearbeitung, relevante Informationen herauszuarbeiten und fehlende Informationen gezielt zu beschaffen.",
          "grades": [7],
          "referenceIds": ["INF7-16-GYM-PK-MI-001"],
          "limitations": [
            "Der Record definiert eine fachliche Handlung und keine homogene Eingangsvoraussetzung aller Lernenden."
          ]
        }
      ],
      "openAgeSpecificQuestions": [
        {
          "id": "LXF03-Q-001",
          "question": "Welche aufgabenbezogenen Vorwissenszugänge zeigen in Klasse 5, 6 und 7 ausreichend früh, ob ein Modell, Begriff oder Verfahren erklärt werden muss?",
          "grades": [5, 6, 7],
          "decisionOwner": "LXF04",
          "implications": "LXF04 darf weder Exploration noch direkte Erklärung universell festlegen, sondern muss beide Wege mit einem beobachtbaren Entscheidungspunkt zulassen."
        }
      ],
      "pilotQuestions": [
        {
          "id": "LXF03-P-001",
          "question": "Erzeugen die vorgesehenen Vorwissensaufgaben verwertbare fachliche Hinweise, ohne Lernende festzuschreiben oder unnötig persönliche Angaben zu verlangen?",
          "grades": [5, 6, 7],
          "evidenceNeeded": "Anonymisierte Aufgabenprodukte, typische Rückfragen, benötigte Hilfen und dokumentierte Lehrkraftentscheidungen je Jahrgang.",
          "privacyBoundary": "non-personal-observation-only"
        }
      ]
    },
    {
      "id": "reading-and-disciplinary-language",
      "label": "Lesen und Fachsprache",
      "evidenceSupportedAssumptions": [
        {
          "id": "LXF03-S-003",
          "statement": "Verständliche Zwecke, explizite Schritte und zugängliche Sprache reduzieren vermeidbare Zugangsbarrieren, ohne die fachliche Denkhandlung oder notwendige Fachbegriffe zu ersetzen.",
          "claimIds": ["CLAIM-V2-LXF-COGA-001", "CLAIM-V2-LXF-UDL-001"],
          "grades": [5, 6, 7],
          "variability": "Leseflüssigkeit, Bildungssprache, Mehrsprachigkeit, Kenntnis von Operatoren und Sicherheit beim schriftlichen Erklären variieren in jedem Jahrgang und je Aufgabenformat.",
          "designConsequence": {
            "learnerMaterial": "Aufträge nennen Zweck, fachliche Sprachhandlung und Produkt; Begriffe, Beispiele, Darstellungen und optionale Sprachgerüste stehen dort bereit, wo sie benötigt werden.",
            "teacherOrchestration": "Die Lehrkraft unterscheidet durch Rückfrage oder Zwischenprodukt zwischen fachlicher, sprachlicher und bedienbezogener Hürde und passt Unterstützung entsprechend an."
          },
          "status": "working",
          "limitations": [
            "COGA und UDL sind professionelle Guidance und keine kausalen Nachweise für eine konkrete sprachliche IuM-Methode.",
            "Verständliche Sprache darf fachliche Präzision, Operatoren oder die erwartete Begründungsleistung nicht einebnen."
          ]
        },
        {
          "id": "LXF03-S-004",
          "statement": "Fachlich zusammengehörige Wörter, Bilder, Zustände und Abläufe benötigen konsistente Bezeichner sowie sichtbare Zuordnungen, damit Lernende Beziehungen auswählen, organisieren und integrieren können.",
          "claimIds": ["CLAIM-LP-003", "CLAIM-V2-LXF-MAYER-001", "CLAIM-V2-LXF-SIGNAL-001"],
          "grades": [5, 6, 7],
          "variability": "Vorwissen über Darstellungsformen, Symbolsysteme und Fachbegriffe verändert, welche Zuordnung selbsterklärend ist und welche modelliert oder sprachlich gestützt werden muss.",
          "designConsequence": {
            "learnerMaterial": "Text, Diagramm, Code, Interfacezustand und Ablauf verwenden stabile Begriffe; Signale markieren fachliche Beziehungen statt bloßer optischer Salienz.",
            "teacherOrchestration": "Die Lehrkraft lässt Beziehungen erklären, übersetzen oder am Beispiel zeigen und klärt nicht verstandene Fachbegriffe vor weiterer Verdichtung."
          },
          "status": "working",
          "limitations": [
            "Aus Multimedia- und Signaling-Evidenz folgt kein Vorrang visueller Darstellung für jede Aufgabe oder Person.",
            "Farbe allein darf keine fachlich notwendige Beziehung tragen."
          ]
        }
      ],
      "curriculumAndProjectExpectations": [
        {
          "id": "LXF03-E-004",
          "basis": "official-curriculum",
          "statement": "Der Basiskurs Medienbildung verlangt bereits in Klasse 5 die richtige Verwendung von Fachbegriffen.",
          "grades": [5],
          "referenceIds": ["BMB16-GYM-PK-SK-001"],
          "limitations": [
            "Der Record bestimmt keine einzelne Methode des Begriffserwerbs und keine sprachliche Eingangsvoraussetzung."
          ]
        },
        {
          "id": "LXF03-E-005",
          "basis": "official-curriculum",